/**
 * Created by grahamallen on 6/28/16.
 */

var csData = {
    "data": [{
        "objectid": 867720,
        "inventorynumber": "2011-A4",
        "uniqueid": "5766725441",
        "objecttype": "Antiquities",
        "imperialdims": "Object: 12 3/8 in.",
        "metricdims": "Object: 31.43 cm.",
        "dimensiondescription": "Object",
        "heightimperial": 12.375,
        "heightmetric": 31.4325,
        "mainimageattachmentid": 994554,
        "mainimagefilename": "2011-A4.jpg",
        "mainimagefilesize": 117069,
        "locationid": 90375,
        "locationname": "On Loan",
        "fulllocationname": "On Loan",
        "collectionid": 20761,
        "collectionname": "Antiquities",
        "fullcollectionname": "Antiquities",
        "title": "An Ushabti of Djehuty-Mose (Tothmes), Overseer of the Cattle in the Temple of Amun",
        "medium": "polychrome limestone",
        "objectdate": "19th Dynasty, 1292-1190 B.C.",
        "countryorigin": "Egyptian",
        "objectdescription": "Holding a djed-pillar and Knot of Isis, and wearing a pleated shirt and kilt with overfold, a ba-bird with wings outstretched on the chest, broad beaded collar, short beard, and double wig of echeloned and zig-zag curls bound in a headband, his face with full outlined lips indented at the corners, straight nose, and large eyes with long eyebrows and cosmetic lines painted in black, columns and lines of inscription on the kilt.",
        "objectstatuscode": 1,
        "objectstatus": "Current",
        "deaccessioned": false,
        "deleted": false,
        "currentconditionrating": "Excellent-Good",
        "currentconditionstatus": "Needs Immediate Attention",
        "currentconditioncontact": "Smith, Jane",
        "currentconditionexaminedon": "2012-02-06T10:30:00",
        "currentconservationstatus": "Excellent-Good",
        "currentconservationcontact": "Lynden, Emelia - Preservation Inc.",
        "currenttreatmentdate": "2012-02-06T10:30:00",
        "currenttreatmentmemo": "Currently undergoing treatment",
        "defaultcurrencytype": "USD",
        "acquisitionid": 182675,
        "acquisitionsubject": "Acquisition 4",
        "acquisitiontype": "Purchase",
        "acquisitiondate": "2010-12-07T00:00:00",
        "acquiredfrom": "Sotheby's NY Sale N08723",
        "boughtby": "Smith, John",
        "ownercontactname": "Smith, John",
        "acquisitiondetails": "Lot 27",
        "acquisitionprice": 1314500.0000,
        "acquisitionpostdiscounttotal": 1314500.0000,
        "acquisitiontotal": 1314500.0000,
        "acquisitioncurrencytypeid": 51,
        "acquisitioncurrencytype": "USD",
        "domesticacquisitionprice": 1314500.0000,
        "domesticacquisitionpostdiscounttotal": 1314500.0000,
        "domesticacquisitiontotal": 1314500.0000,
        "acquisitionconversionrate": 1.0,
        "currentvaluationsubject": "Insurance Appraisal",
        "currentvaluationdate": "2011-05-11T00:00:00",
        "currentvaluetype": "Insurance",
        "currentvaluationcurrencytypeid": 51,
        "currentvaluationcurrencytype": "USD",
        "currentvaluationcontact": "Appraisals R Us",
        "currentvalue": 1314500.0000,
        "currentdomesticvalue": 1314500.0000,
        "currentvaluationconversionrate": 1.0,
        "currentinsurancepolicysubject": "Policy 1",
        "currentinsurancepolicynumber": "123123132",
        "currentinsurancecontact": "MU Insurance",
        "currentinsurancepolicystartdate": "2012-02-26T00:00:00",
        "currentinsurancepolicyenddate": "2013-02-26T00:00:00",
        "currentinsuredvaluecurrencytypeid": 51,
        "currentinsuredvaluecurrencytype": "USD",
        "currentinsuredvalue": 1500000.0000,
        "currentdomesticinsuredvalue": 1500000.0000,
        "currentinsuredvalueconversionrate": 1.0,
        "conditions": [{
            "conditionid": 149115,
            "conditionexaminedon": "2012-02-06T10:30:00",
            "conditionstatus": "Needs Immediate Attention",
            "conditionrating": "Excellent-Good",
            "conditioncontactid": 82192,
            "conditioncontact": "Smith, Jane"
        }],
        "conservation": [{
            "conservationid": 2204,
            "treatmentdate": "2012-02-06T10:30:00",
            "conservationstatus": "Excellent-Good",
            "conservationcontactid": 82199,
            "conservationcontact": "Lynden, Emelia - Preservation Inc.",
            "treatmentmemo": "Currently undergoing treatment"
        }],
        "dimensions": [{
            "dimensionid": 640430,
            "dimensiondescription": "Object",
            "imperialdims": "Object: 12 3/8 in.",
            "heightimperial": 12.375,
            "metricdims": "Object: 31.43 cm.",
            "heightmetric": 31.4325
        }],
        "exhibitions": [{
            "exhibitionid": 28055,
            "exhibitionsubject": "Art of the Ancient World - September 11th 2010 - January 15th 2011",
            "exhibitiontitle": "Art of the Ancient World",
            "exhibitiondate": "09/11/2010 - 01/15/2011",
            "exhibitiondatesort": "2010-09-11T00:00:00",
            "exhibitionstartdate": "09/11/2010",
            "exhibitionstartdatesort": "2010-09-11T00:00:00",
            "exhibitionenddate": "01/15/2011",
            "exhibitionenddatesort": "2011-01-15T00:00:00",
            "exhibitionlocation": "New York, NY"
        }],
        "expenses": [{
            "expenseid": 200208,
            "expensetype": "Acquisition",
            "expensedate": "12/07/2010",
            "expensedatesort": "2010-12-07T00:00:00",
            "expenseamount": 1314500.0000,
            "expensetotal": 1314500.0000,
            "domesticexpenseamount": 1314500.0000,
            "domesticexpensetotal": 1314500.0000,
            "expensecurrencytype": "USD",
            "defaultcurrencytype": "USD",
            "expenseconversionrate": 1.0,
            "expensecontactid": 82174,
            "expensecontact": "Sotheby's NY Sale N08723"
        }],
        "groups": [{"groupid": 7494, "groupdescription": "objects to show"}],
        "images": [{"attachmentid": 994554, "filename": "2011-A4.jpg", "filesize": 117069}],
        "insurancepolicies": [{
            "insurancepolicyid": 8113,
            "insurancepolicysubject": "Policy 1",
            "insurancepolicynumber": "123123132",
            "insurancecontactid": 82212,
            "insurancecontact": "MU Insurance",
            "insurancepolicystartdate": "2012-02-26T00:00:00",
            "insurancepolicyenddate": "2013-02-26T00:00:00",
            "insuredvalue": 1500000.0000,
            "domesticinsuredvalue": 1500000.0000,
            "insuredvaluecurrencytype": "USD",
            "defaultcurrencytype": "USD",
            "insuredvalueconversionrate": 1.0
        }],
        "valuations": [{
            "valuationid": 39599,
            "valuationstatus": "Closed",
            "valuationsubject": "Insurance Appraisal",
            "valuationdate": "2011-05-11T00:00:00",
            "valuetype": "Insurance",
            "valuationcontactid": 82193,
            "valuationcontact": "Appraisals R Us",
            "value": 1314500.0000,
            "domesticvalue": 1314500.0000,
            "valuationcurrencytype": "USD",
            "defaultcurrencytype": "USD",
            "valuationconversionrate": 1.0,
            "objectvaluationmemo": "Based on purchase price"
        }]
    }, {
        "objectid": 867721,
        "inventorynumber": "2011-FA4",
        "uniqueid": "9616841605",
        "objecttype": "Paintings",
        "imperialdims": "Canvas: 36 x 28 5/8 in.",
        "metricdims": "Canvas: 91.44 x 72.71 cm.",
        "dimensiondescription": "Canvas",
        "heightimperial": 36.0,
        "heightmetric": 91.44,
        "widthimperial": 28.625,
        "widthmetric": 72.7075,
        "artistid": 179438,
        "artistname": "Bravo, Claudio 1936-",
        "artistfirst": "Claudio",
        "artistlast": "Bravo",
        "artistyears": "1936-",
        "mainimageattachmentid": 994570,
        "mainimagefilename": "2011-FA4.jpg",
        "mainimagefilesize": 260568,
        "locationid": 90375,
        "locationname": "On Loan",
        "fulllocationname": "On Loan",
        "collectionid": 20762,
        "collectionname": "Fine Art",
        "fullcollectionname": "Fine Art",
        "title": "White and Yellow Package",
        "medium": "oil on canvas",
        "objectdate": "2005",
        "signatures": "Signed lower left and dated MMV lower right",
        "provenance": "Marlborough Gallery, New York<BR />Sale: Christie's, New York, Latin American Sale Evening Session, May 28, 2008, lot 6, illustrated in color<BR />Acquired from the above by the present owner",
        "objectstatuscode": 1,
        "objectstatus": "Current",
        "deaccessioned": false,
        "deleted": false,
        "currentframeconditioncontact": "Shade, Fiona",
        "currentframeconditionexaminedon": "2013-04-05T00:00:00",
        "currentframeconditionmemo": "Restoration",
        "defaultcurrencytype": "USD",
        "acquisitionid": 182654,
        "acquisitionsubject": "Acquisition 20",
        "acquisitiontype": "Purchase",
        "acquisitiondate": "2010-05-27T00:00:00",
        "acquiredfrom": "Sotheby's NY Sale N08642",
        "boughtby": "Smith, John",
        "ownercontactname": "Smith, John",
        "acquisitiondetails": "Lot 11",
        "acquisitionprice": 458500.0000,
        "acquisitionpostdiscounttotal": 458500.0000,
        "acquisitiontotal": 458500.0000,
        "acquisitioncurrencytypeid": 51,
        "acquisitioncurrencytype": "USD",
        "domesticacquisitionprice": 458500.0000,
        "domesticacquisitionpostdiscounttotal": 458500.0000,
        "domesticacquisitiontotal": 458500.0000,
        "acquisitionconversionrate": 1.0,
        "currentvaluationsubject": "Insurance Appraisal",
        "currentvaluationdate": "2011-05-11T00:00:00",
        "currentvaluetype": "Insurance",
        "currentvaluationcurrencytypeid": 51,
        "currentvaluationcurrencytype": "USD",
        "currentvaluationcontact": "Appraisals R Us",
        "currentvalue": 458500.0000,
        "currentdomesticvalue": 458500.0000,
        "currentvaluationconversionrate": 1.0,
        "currentinsurancepolicysubject": "Policy 2",
        "currentinsurancepolicynumber": "123123132",
        "currentinsurancecontact": "MU Insurance",
        "currentinsurancepolicystartdate": "2012-02-26T00:00:00",
        "currentinsurancepolicyenddate": "2013-02-26T00:00:00",
        "currentinsuredvaluecurrencytypeid": 51,
        "currentinsuredvaluecurrencytype": "USD",
        "dimensions": [{
            "dimensionid": 640446,
            "dimensiondescription": "Canvas",
            "imperialdims": "Canvas: 36 x 28 5/8 in.",
            "heightimperial": 36.0,
            "widthimperial": 28.625,
            "metricdims": "Canvas: 91.44 x 72.71 cm.",
            "heightmetric": 91.44,
            "widthmetric": 72.7075
        }],
        "expenses": [{
            "expenseid": 200209,
            "expensetype": "Acquisition",
            "expensedate": "05/27/2010",
            "expensedatesort": "2010-05-27T00:00:00",
            "expenseamount": 458500.0000,
            "expensetotal": 458500.0000,
            "domesticexpenseamount": 458500.0000,
            "domesticexpensetotal": 458500.0000,
            "expensecurrencytype": "USD",
            "defaultcurrencytype": "USD",
            "expenseconversionrate": 1.0,
            "expensecontactid": 82166,
            "expensecontact": "Sotheby's NY Sale N08642"
        }],
        "frameconditions": [{
            "frameconditionid": 18395,
            "frameconditionexaminedon": "2013-04-05T00:00:00",
            "frameconditioncontactid": 82209,
            "frameconditioncontact": "Shade, Fiona",
            "frameconditionmemo": "Restoration"
        }],
        "groups": [{"groupid": 7494, "groupdescription": "objects to show"}],
        "images": [{"attachmentid": 994570, "filename": "2011-FA4.jpg", "filesize": 260568}],
        "insurancepolicies": [{
            "insurancepolicyid": 8124,
            "insurancepolicysubject": "Policy 2",
            "insurancepolicynumber": "123123132",
            "insurancecontactid": 82212,
            "insurancecontact": "MU Insurance",
            "insurancepolicystartdate": "2012-02-26T00:00:00",
            "insurancepolicyenddate": "2013-02-26T00:00:00",
            "insuredvaluecurrencytype": "USD",
            "defaultcurrencytype": "USD"
        }],
        "shipments": [{
            "shipmentid": 16620,
            "shipmentstatus": "In Progress",
            "shipmentsubject": "Traveling Exhibition",
            "shipmentreleasedate": "2013-04-10T00:00:00",
            "releaselocationid": 90373,
            "releaselocation": "Miami Beach"
        }],
        "valuations": [{
            "valuationid": 39599,
            "valuationstatus": "Closed",
            "valuationsubject": "Insurance Appraisal",
            "valuationdate": "2011-05-11T00:00:00",
            "valuetype": "Insurance",
            "valuationcontactid": 82193,
            "valuationcontact": "Appraisals R Us",
            "value": 458500.0000,
            "domesticvalue": 458500.0000,
            "valuationcurrencytype": "USD",
            "defaultcurrencytype": "USD",
            "valuationconversionrate": 1.0,
            "objectvaluationmemo": "Based on purchase price"
        }]
    }, {
        "objectid": 867722,
        "inventorynumber": "2011-F5",
        "uniqueid": "0791370820",
        "objecttype": "Furniture",
        "imperialdims": "Object: 25 1/4 x 76 1/4 x 26 1/2 in.",
        "metricdims": "Object: 64.14 x 193.68 x 67.31 cm.",
        "dimensiondescription": "Object",
        "heightimperial": 25.25,
        "heightmetric": 64.135,
        "widthimperial": 76.25,
        "widthmetric": 193.675,
        "depthimperial": 26.5,
        "depthmetric": 67.31,
        "artistid": 179440,
        "artistname": "Wormley, Edward 1907-1995",
        "artistfirst": "Edward",
        "artistlast": "Wormley",
        "artistyears": "1907-1995",
        "mainimageattachmentid": 994563,
        "mainimagefilename": "2011-F5.jpg",
        "mainimagefilesize": 216969,
        "locationid": 90375,
        "locationname": "On Loan",
        "fulllocationname": "On Loan",
        "collectionid": 20763,
        "collectionname": "Furniture",
        "fullcollectionname": "Furniture",
        "title": "\"Listen To Me\" Chaise, Model no. 4873",
        "medium": "maple, cherry, and steel with original fabric upholstery",
        "objectdate": "c. 1978",
        "labels": "With manufacturer's metal tag",
        "objectstatuscode": 1,
        "objectstatus": "Undocumented",
        "deaccessioned": false,
        "deleted": false,
        "defaultcurrencytype": "USD",
        "acquisitionid": 182646,
        "acquisitionsubject": "Acquisition 13",
        "acquisitiontype": "Purchase",
        "acquisitiondate": "2007-06-19T00:00:00",
        "acquiredfrom": "Sotheby's NY Sale N08331",
        "boughtby": "Smith, John",
        "ownercontactname": "Smith, John",
        "acquisitiondetails": "Lot 99",
        "acquisitionprice": 66000.0000,
        "acquisitionpostdiscounttotal": 66000.0000,
        "acquisitiontotal": 66000.0000,
        "acquisitioncurrencytypeid": 51,
        "acquisitioncurrencytype": "USD",
        "domesticacquisitionprice": 66000.0000,
        "domesticacquisitionpostdiscounttotal": 66000.0000,
        "domesticacquisitiontotal": 66000.0000,
        "acquisitionconversionrate": 1.0,
        "currentvaluationsubject": "Insurance Appraisal",
        "currentvaluationdate": "2011-05-11T00:00:00",
        "currentvaluetype": "Insurance",
        "currentvaluationcurrencytypeid": 51,
        "currentvaluationcurrencytype": "USD",
        "currentvaluationcontact": "Appraisals R Us",
        "currentvalue": 66000.0000,
        "currentdomesticvalue": 66000.0000,
        "currentvaluationconversionrate": 1.0,
        "currentinsurancepolicysubject": "Policy 3",
        "currentinsurancepolicynumber": "123123132",
        "currentinsurancecontact": "MU Insurance",
        "currentinsurancepolicystartdate": "2012-02-26T00:00:00",
        "currentinsurancepolicyenddate": "2013-02-26T00:00:00",
        "currentinsuredvaluecurrencytypeid": 51,
        "currentinsuredvaluecurrencytype": "USD",
        "dimensions": [{
            "dimensionid": 640439,
            "dimensiondescription": "Object",
            "imperialdims": "Object: 25 1/4 x 76 1/4 x 26 1/2 in.",
            "heightimperial": 25.25,
            "widthimperial": 76.25,
            "depthimperial": 26.5,
            "metricdims": "Object: 64.14 x 193.68 x 67.31 cm.",
            "heightmetric": 64.135,
            "widthmetric": 193.675,
            "depthmetric": 67.31
        }],
        "expenses": [{
            "expenseid": 200250,
            "expensetype": "Other",
            "expensedate": "10/16/1987",
            "expensedatesort": "1987-10-16T00:00:00",
            "expenseamount": 78.3300,
            "expensetotal": 78.3300,
            "domesticexpenseamount": 78.3300,
            "domesticexpensetotal": 78.3300,
            "expensecurrencytype": "USD",
            "defaultcurrencytype": "USD",
            "expenseconversionrate": 1.0,
            "expensecontactid": 82206,
            "expensecontact": "Undine, Lisa - Designers Co.",
            "referencenumber": "Invoice# 108",
            "expensememo": "Design Fee"
        }, {
            "expenseid": 200210,
            "expensetype": "Acquisition",
            "expensedate": "06/19/2007",
            "expensedatesort": "2007-06-19T00:00:00",
            "expenseamount": 66000.0000,
            "expensetotal": 66000.0000,
            "domesticexpenseamount": 66000.0000,
            "domesticexpensetotal": 66000.0000,
            "expensecurrencytype": "USD",
            "defaultcurrencytype": "USD",
            "expenseconversionrate": 1.0,
            "expensecontactid": 82173,
            "expensecontact": "Sotheby's NY Sale N08331"
        }],
        "groups": [{"groupid": 7495, "groupdescription": "Furniture"}],
        "images": [{"attachmentid": 994563, "filename": "2011-F5.jpg", "filesize": 216969}],
        "insurancepolicies": [{
            "insurancepolicyid": 8135,
            "insurancepolicysubject": "Policy 3",
            "insurancepolicynumber": "123123132",
            "insurancecontactid": 82212,
            "insurancecontact": "MU Insurance",
            "insurancepolicystartdate": "2012-02-26T00:00:00",
            "insurancepolicyenddate": "2013-02-26T00:00:00",
            "insuredvaluecurrencytype": "USD",
            "defaultcurrencytype": "USD"
        }],
        "shipments": [{
            "shipmentid": 16620,
            "shipmentstatus": "In Progress",
            "shipmentsubject": "Traveling Exhibition",
            "shipmentreleasedate": "2013-04-10T00:00:00",
            "releaselocationid": 90373,
            "releaselocation": "Miami Beach"
        }],
        "valuations": [{
            "valuationid": 39599,
            "valuationstatus": "Closed",
            "valuationsubject": "Insurance Appraisal",
            "valuationdate": "2011-05-11T00:00:00",
            "valuetype": "Insurance",
            "valuationcontactid": 82193,
            "valuationcontact": "Appraisals R Us",
            "value": 66000.0000,
            "domesticvalue": 66000.0000,
            "valuationcurrencytype": "USD",
            "defaultcurrencytype": "USD",
            "valuationconversionrate": 1.0,
            "objectvaluationmemo": "Based on purchase price"
        }]
    }, {
        "objectid": 867723,
        "inventorynumber": "2011-A8",
        "uniqueid": "0795915982",
        "objecttype": "Antiquities",
        "imperialdims": "Object: 14 x 8 in.",
        "metricdims": "Object: 35.56 x 20.32 cm.",
        "dimensiondescription": "Object",
        "heightimperial": 14.0,
        "heightmetric": 35.56,
        "widthimperial": 8.0,
        "widthmetric": 20.32,
        "mainimageattachmentid": 994558,
        "mainimagefilename": "2011-A8.jpg",
        "mainimagefilesize": 309435,
        "locationid": 90379,
        "locationname": "New York Apartment",
        "fulllocationname": "New York Apartment - Dining Room",
        "collectionid": 20761,
        "collectionname": "Antiquities",
        "fullcollectionname": "Antiquities",
        "title": "A Mummy Portrait of a Man, Antonine",
        "medium": "encaustic",
        "objectdate": "c. A.D. 138-192",
        "objectdescription": "Painted on wood, his head turned to his right, and wearing a white chiton and himation draped high over the nape of the neck, his face with long beard and moustache, full lips, aquiline nose, arched brows, and thick richly curled hair.",
        "objectstatuscode": 1,
        "objectstatus": "Undocumented",
        "deaccessioned": false,
        "deleted": false,
        "currentconservationstatus": "OK",
        "currenttreatmentdate": "2010-08-17T00:00:00",
        "defaultcurrencytype": "USD",
        "acquisitionid": 182679,
        "acquisitionsubject": "Acquisition 8",
        "acquisitiontype": "Purchase",
        "acquisitiondate": "2007-06-07T00:00:00",
        "acquiredfrom": "Sotheby's NY Sale N08325",
        "boughtby": "Smith, John",
        "ownercontactname": "Smith, John",
        "acquisitiondetails": "Lot 27",
        "acquisitionprice": 936000.0000,
        "acquisitionpostdiscounttotal": 936000.0000,
        "acquisitiontotal": 936000.0000,
        "acquisitioncurrencytypeid": 51,
        "acquisitioncurrencytype": "USD",
        "domesticacquisitionprice": 936000.0000,
        "domesticacquisitionpostdiscounttotal": 936000.0000,
        "domesticacquisitiontotal": 936000.0000,
        "acquisitionconversionrate": 1.0,
        "currentvaluationsubject": "Insurance Appraisal",
        "currentvaluationdate": "2011-05-11T00:00:00",
        "currentvaluetype": "Insurance",
        "currentvaluationcurrencytypeid": 51,
        "currentvaluationcurrencytype": "USD",
        "currentvaluationcontact": "Appraisals R Us",
        "currentvalue": 936000.0000,
        "currentdomesticvalue": 936000.0000,
        "currentvaluationconversionrate": 1.0,
        "currentinsurancepolicysubject": "Policy 11",
        "currentinsurancepolicynumber": "123123132",
        "currentinsurancecontact": "MU Insurance",
        "currentinsurancepolicystartdate": "2012-02-26T00:00:00",
        "currentinsurancepolicyenddate": "2013-02-26T00:00:00",
        "currentinsuredvaluecurrencytypeid": 51,
        "currentinsuredvaluecurrencytype": "USD",
        "conservation": [{"conservationid": 2208, "treatmentdate": "2010-08-17T00:00:00", "conservationstatus": "OK"}],
        "dimensions": [{
            "dimensionid": 640434,
            "dimensiondescription": "Object",
            "imperialdims": "Object: 14 x 8 in.",
            "heightimperial": 14.0,
            "widthimperial": 8.0,
            "metricdims": "Object: 35.56 x 20.32 cm.",
            "heightmetric": 35.56,
            "widthmetric": 20.32
        }],
        "expenses": [{
            "expenseid": 200211,
            "expensetype": "Acquisition",
            "expensedate": "06/07/2007",
            "expensedatesort": "2007-06-07T00:00:00",
            "expenseamount": 936000.0000,
            "expensetotal": 936000.0000,
            "domesticexpenseamount": 936000.0000,
            "domesticexpensetotal": 936000.0000,
            "expensecurrencytype": "USD",
            "defaultcurrencytype": "USD",
            "expenseconversionrate": 1.0,
            "expensecontactid": 82183,
            "expensecontact": "Sotheby's NY Sale N08325"
        }],
        "groups": [{"groupid": 7493, "groupdescription": "things i want to consider"}],
        "images": [{"attachmentid": 994558, "filename": "2011-A8.jpg", "filesize": 309435}],
        "insurancepolicies": [{
            "insurancepolicyid": 8115,
            "insurancepolicysubject": "Policy 11",
            "insurancepolicynumber": "123123132",
            "insurancecontactid": 82212,
            "insurancecontact": "MU Insurance",
            "insurancepolicystartdate": "2012-02-26T00:00:00",
            "insurancepolicyenddate": "2013-02-26T00:00:00",
            "insuredvaluecurrencytype": "USD",
            "defaultcurrencytype": "USD"
        }],
        "loans": [{
            "loanid": 5333,
            "exhibitionname": "Antiquities",
            "borrower": "Metropolitan Museum of Art",
            "loansubject": "Loan 1",
            "loantype": "Loan In",
            "loanstartdate": "2012-08-07T00:00:00",
            "loanenddate": "2013-08-07T00:00:00",
            "loanreleasedate": "2012-07-05T00:00:00",
            "loanreceiveddate": "2012-07-25T00:00:00",
            "insurer": "Antiquities Insurance",
            "insuredtotal": 150000.0000,
            "domesticinsuredtotal": 150000.0000,
            "defaultcurrencytype": "USD",
            "loanconversionrate": 1.0,
            "insuredtotalcurrencytype": "USD",
            "loanmemo": "Only for display in a glass case"
        }],
        "publications": [{
            "publicationid": 35209,
            "publicationtitle": "\"Four Fayum Portraits in the Fogg Art Museum\"",
            "author": "Daisie B. Tanner",
            "publicationtype": "Journal",
            "publicationdate": "1932/1933",
            "publicationdatesort": "1933-02-01T00:00:00",
            "journal": "Bulletin of the Fogg Art Museum, Vol. 2",
            "publicationmemo": "pp. 4-9, Fig. 3"
        }],
        "valuations": [{
            "valuationid": 39599,
            "valuationstatus": "Closed",
            "valuationsubject": "Insurance Appraisal",
            "valuationdate": "2011-05-11T00:00:00",
            "valuetype": "Insurance",
            "valuationcontactid": 82193,
            "valuationcontact": "Appraisals R Us",
            "value": 936000.0000,
            "domesticvalue": 936000.0000,
            "valuationcurrencytype": "USD",
            "defaultcurrencytype": "USD",
            "valuationconversionrate": 1.0,
            "objectvaluationmemo": "Based on purchase price"
        }]
    }, {
        "objectid": 867724,
        "inventorynumber": "2011-J8",
        "uniqueid": "3009773500",
        "objecttype": "Jewelry & Watches",
        "mainimageattachmentid": 994582,
        "mainimagefilename": "2011-J8.jpg",
        "mainimagefilesize": 1438840,
        "locationid": 90379,
        "locationname": "New York Apartment",
        "fulllocationname": "New York Apartment - Dining Room",
        "collectionid": 20764,
        "collectionname": "Jewelry",
        "fullcollectionname": "Jewelry",
        "title": "Pair of Gold, Sapphire, and Diamond Earclips",
        "medium": "gold, sapphire, and diamond",
        "objectdescription": "Set in the center with oval sapphires weighing approximately 46.35 and 42.35 carats, framed by old mine diamonds weighing approximately 10.75 carats.",
        "objectstatuscode": 1,
        "objectstatus": "Undocumented",
        "deaccessioned": false,
        "deleted": false,
        "defaultcurrencytype": "USD",
        "acquisitionid": 182667,
        "acquisitionsubject": "Acquisition 32",
        "acquisitiontype": "Purchase",
        "acquisitiondate": "2010-04-20T00:00:00",
        "acquiredfrom": "Sotheby's NY Sale N08626",
        "boughtby": "Smith, John",
        "ownercontactname": "Smith, John",
        "acquisitiondetails": "Lot 225",
        "acquisitionprice": 122500.0000,
        "acquisitionpostdiscounttotal": 122500.0000,
        "acquisitiontotal": 122500.0000,
        "acquisitioncurrencytypeid": 51,
        "acquisitioncurrencytype": "USD",
        "domesticacquisitionprice": 122500.0000,
        "domesticacquisitionpostdiscounttotal": 122500.0000,
        "domesticacquisitiontotal": 122500.0000,
        "acquisitionconversionrate": 1.0,
        "currentvaluationsubject": "Insurance Appraisal",
        "currentvaluationdate": "2011-05-11T00:00:00",
        "currentvaluetype": "Insurance",
        "currentvaluationcurrencytypeid": 51,
        "currentvaluationcurrencytype": "USD",
        "currentvaluationcontact": "Appraisals R Us",
        "currentvalue": 122500.0000,
        "currentdomesticvalue": 122500.0000,
        "currentvaluationconversionrate": 1.0,
        "currentinsurancepolicysubject": "Policy 10",
        "currentinsurancepolicynumber": "123123132",
        "currentinsurancecontact": "MU Insurance",
        "currentinsurancepolicystartdate": "2012-02-26T00:00:00",
        "currentinsurancepolicyenddate": "2013-02-26T00:00:00",
        "currentinsuredvaluecurrencytypeid": 51,
        "currentinsuredvaluecurrencytype": "USD",
        "saleprice": 12235.0000,
        "salediscount": 10.0000,
        "salediscountpercent": 0.081732733959950954,
        "saletax": 79.0000,
        "saletaxpercent": 0.64621676891615543,
        "salepostdiscounttotal": 12225.0000,
        "saletotal": 12304.0000,
        "domesticsaleprice": 12235.0000,
        "domesticsalediscount": 10.0000,
        "domesticsalediscountpercent": 0.081732733959950954,
        "domesticsaletax": 79.0000,
        "domesticsaletaxpercent": 0.64621676891615543,
        "domesticsalepostdiscounttotal": 12225.0000,
        "domesticsaletotal": 12304.0000,
        "saleconversionrate": 1.0,
        "saleinvoicedate": "2003-11-15T00:00:00",
        "saledetails": "Gallery",
        "soldtocontact": "Dunkin, Fiona",
        "salelocation": "San Francisco",
        "salenumber": "618",
        "saledescription": "Sale 6",
        "salelotnumber": "14",
        "salecurrencytypeid": 51,
        "salecurrencytype": "USD",
        "components": [{
            "componentid": 4869,
            "componentnumber": "2",
            "componentlocationstatus": "Permanent Location",
            "componentlocationid": 90407,
            "componentfulllocationname": "Dining Room - Storage - Jewelry Case - Earring Section",
            "componentmaker": "Unknown",
            "componentmedium": "gold, sapphire, and diamond",
            "componentform": "Earring",
            "componentsubject": "Jewelry",
            "componentdimensiondescription": "Individual earring",
            "componentimperialdims": "Individual earring: 0 1/2 x 0 1/4 x 0 1/8 in. dia: 1 in.weight: 0.25 lbs.",
            "componentheightimperial": 0.5,
            "componentwidthimperial": 0.25,
            "componentdepthimperial": 0.125,
            "componentdiameterimperial": 1.0,
            "componentweightimperial": 0.25,
            "componentmetricdims": "Individual earring: 1.27 x 0.64 x 0.32 cm. dia: 2.54 cm. weight: 0.11 kg.",
            "componentheightmetric": 1.27,
            "componentwidthmetric": 0.635,
            "componentdepthmetric": 0.3175,
            "componentdiametermetric": 2.54,
            "componentweightmetric": 0.1133980925,
            "componentdimensionmemo": "Not including clip",
            "componentdescription": "Individual earring",
            "componentsignatures": "None",
            "componentinscriptions": "None",
            "componentlabels": "None",
            "componentprovenance": "Direct from Jeweler",
            "componentdeaccessioned": false
        }],
        "expenses": [{
            "expenseid": 200212,
            "expensetype": "Acquisition",
            "expensedate": "04/20/2010",
            "expensedatesort": "2010-04-20T00:00:00",
            "expenseamount": 122500.0000,
            "expensetotal": 122500.0000,
            "domesticexpenseamount": 122500.0000,
            "domesticexpensetotal": 122500.0000,
            "expensecurrencytype": "USD",
            "defaultcurrencytype": "USD",
            "expenseconversionrate": 1.0,
            "expensecontactid": 82176,
            "expensecontact": "Sotheby's NY Sale N08626"
        }],
        "images": [{"attachmentid": 994582, "filename": "2011-J8.jpg", "filesize": 1438840}],
        "insurancepolicies": [{
            "insurancepolicyid": 8114,
            "insurancepolicysubject": "Policy 10",
            "insurancepolicynumber": "123123132",
            "insurancecontactid": 82212,
            "insurancecontact": "MU Insurance",
            "insurancepolicystartdate": "2012-02-26T00:00:00",
            "insurancepolicyenddate": "2013-02-26T00:00:00",
            "insuredvaluecurrencytype": "USD",
            "defaultcurrencytype": "USD"
        }],
        "valuations": [{
            "valuationid": 39599,
            "valuationstatus": "Closed",
            "valuationsubject": "Insurance Appraisal",
            "valuationdate": "2011-05-11T00:00:00",
            "valuetype": "Insurance",
            "valuationcontactid": 82193,
            "valuationcontact": "Appraisals R Us",
            "value": 122500.0000,
            "domesticvalue": 122500.0000,
            "valuationcurrencytype": "USD",
            "defaultcurrencytype": "USD",
            "valuationconversionrate": 1.0,
            "objectvaluationmemo": "Based on purchase price"
        }]
    }, {
        "objectid": 867725,
        "inventorynumber": "2011-S2",
        "uniqueid": "6844700915",
        "objecttype": "Sculpture",
        "imperialdims": "Without feathers: 19 1/8 in.",
        "metricdims": "Without feathers: 48.58 cm.",
        "dimensiondescription": "Without feathers",
        "heightimperial": 19.125,
        "heightmetric": 48.5775,
        "mainimageattachmentid": 994585,
        "mainimagefilename": "2011-S2.jpg",
        "mainimagefilesize": 299643,
        "locationid": 90379,
        "locationname": "New York Apartment",
        "fulllocationname": "New York Apartment - Dining Room",
        "collectionid": 20765,
        "collectionname": "Sculpture",
        "fullcollectionname": "Sculpture",
        "title": "Biwat (Mundugumor) Male, Ancestor Spirit Figure from a Sacred Flute",
        "countryorigin": "Wusear, Papua New Guinea",
        "objectdescription": "Contains Tridacna (tridacna gigas), Money Cowrie (cyprea moneta), Cone (conus sp.) and Pearl Oyster (pinctada sp.) shell, Northern Cassowary (c. unappendiculatus) feathers and human (homo sapian) hair and teeth.",
        "provenance": "Reportedly collected before 1900 during a German expedition, possibly during the von Schleinitz Expedition in 1886",
        "objectstatuscode": 1,
        "objectstatus": "Undocumented",
        "deaccessioned": false,
        "deleted": false,
        "defaultcurrencytype": "USD",
        "acquisitionid": 182669,
        "acquisitionsubject": "Acquisition 34",
        "acquisitiontype": "Purchase",
        "acquisitiondate": "2010-05-14T00:00:00",
        "acquiredfrom": "Sotheby's NY Sale N08638",
        "boughtby": "Smith, John",
        "ownercontactname": "Smith, John",
        "acquisitiondetails": "Lot 89",
        "acquisitionprice": 2098500.0000,
        "acquisitionpostdiscounttotal": 2098500.0000,
        "acquisitiontotal": 2098500.0000,
        "acquisitioncurrencytypeid": 51,
        "acquisitioncurrencytype": "USD",
        "domesticacquisitionprice": 2098500.0000,
        "domesticacquisitionpostdiscounttotal": 2098500.0000,
        "domesticacquisitiontotal": 2098500.0000,
        "acquisitionconversionrate": 1.0,
        "currentvaluationsubject": "Insurance Appraisal",
        "currentvaluationdate": "2011-05-11T00:00:00",
        "currentvaluetype": "Insurance",
        "currentvaluationcurrencytypeid": 51,
        "currentvaluationcurrencytype": "USD",
        "currentvaluationcontact": "Appraisals R Us",
        "currentvalue": 2098500.0000,
        "currentdomesticvalue": 2098500.0000,
        "currentvaluationconversionrate": 1.0,
        "currentinsurancepolicysubject": "Policy 9",
        "currentinsurancepolicynumber": "123123132",
        "currentinsurancecontact": "MU Insurance",
        "currentinsurancepolicystartdate": "2012-02-26T00:00:00",
        "currentinsurancepolicyenddate": "2013-02-26T00:00:00",
        "currentinsuredvaluecurrencytypeid": 51,
        "currentinsuredvaluecurrencytype": "USD",
        "dimensions": [{
            "dimensionid": 640452,
            "dimensiondescription": "Without feathers",
            "imperialdims": "Without feathers: 19 1/8 in.",
            "heightimperial": 19.125,
            "metricdims": "Without feathers: 48.58 cm.",
            "heightmetric": 48.5775
        }],
        "expenses": [{
            "expenseid": 200251,
            "expensetype": "Restoration",
            "expensedate": "5/8/1999",
            "expensedatesort": "1999-05-08T00:00:00",
            "expenseamount": 10.7800,
            "expensetotal": 10.7800,
            "domesticexpenseamount": 10.7800,
            "domesticexpensetotal": 10.7800,
            "expensecurrencytype": "USD",
            "defaultcurrencytype": "USD",
            "expenseconversionrate": 1.0,
            "expensecontactid": 82208,
            "expensecontact": "Preservation Inc."
        }, {
            "expenseid": 200213,
            "expensetype": "Acquisition",
            "expensedate": "05/14/2010",
            "expensedatesort": "2010-05-14T00:00:00",
            "expenseamount": 2098500.0000,
            "expensetotal": 2098500.0000,
            "domesticexpenseamount": 2098500.0000,
            "domesticexpensetotal": 2098500.0000,
            "expensecurrencytype": "USD",
            "defaultcurrencytype": "USD",
            "expenseconversionrate": 1.0,
            "expensecontactid": 82189,
            "expensecontact": "Sotheby's NY Sale N08638"
        }],
        "images": [{"attachmentid": 994585, "filename": "2011-S2.jpg", "filesize": 299643}],
        "insurancepolicies": [{
            "insurancepolicyid": 8148,
            "insurancepolicysubject": "Policy 9",
            "insurancepolicynumber": "123123132",
            "insurancecontactid": 82212,
            "insurancecontact": "MU Insurance",
            "insurancepolicystartdate": "2012-02-26T00:00:00",
            "insurancepolicyenddate": "2013-02-26T00:00:00",
            "insuredvaluecurrencytype": "USD",
            "defaultcurrencytype": "USD"
        }],
        "valuations": [{
            "valuationid": 39599,
            "valuationstatus": "Closed",
            "valuationsubject": "Insurance Appraisal",
            "valuationdate": "2011-05-11T00:00:00",
            "valuetype": "Insurance",
            "valuationcontactid": 82193,
            "valuationcontact": "Appraisals R Us",
            "value": 2098500.0000,
            "domesticvalue": 2098500.0000,
            "valuationcurrencytype": "USD",
            "defaultcurrencytype": "USD",
            "valuationconversionrate": 1.0,
            "objectvaluationmemo": "Based on purchase price"
        }]
    }, {
        "objectid": 867726,
        "inventorynumber": "2011-F6",
        "uniqueid": "2130395241",
        "objecttype": "Furniture",
        "imperialdims": "Object: 15 1/4 x 74 3/4 x 31 1/8 in.",
        "metricdims": "Object: 38.73 x 189.87 x 79.06 cm.",
        "dimensiondescription": "Object",
        "heightimperial": 15.25,
        "heightmetric": 38.735,
        "widthimperial": 74.75,
        "widthmetric": 189.865,
        "depthimperial": 31.125,
        "depthmetric": 79.0575,
        "artistid": 179445,
        "artistname": "Nakashima, George 1905-1990",
        "artistfirst": "George",
        "artistlast": "Nakashima",
        "artistyears": "1905-1990",
        "mainimageattachmentid": 994564,
        "mainimagefilename": "2011-F6.jpg",
        "mainimagefilesize": 167052,
        "locationid": 90379,
        "locationname": "New York Apartment",
        "fulllocationname": "New York Apartment - Dining Room",
        "collectionid": 20763,
        "collectionname": "Furniture",
        "fullcollectionname": "Furniture",
        "title": "\"Minguren I\" Coffee Table",
        "medium": "English oak burl, American black walnut, and East Indian rosewood",
        "objectdate": "1979-1980",
        "signatures": "Signed with client's name and date",
        "provenance": "Acquired directly from the artist",
        "objectstatuscode": 1,
        "objectstatus": "Undocumented",
        "deaccessioned": false,
        "deleted": false,
        "defaultcurrencytype": "USD",
        "acquisitionid": 182647,
        "acquisitionsubject": "Acquisition 14",
        "acquisitiontype": "Purchase",
        "acquisitiondate": "2010-12-10T00:00:00",
        "acquiredfrom": "Sotheby's NY Sale N08680",
        "boughtby": "Smith, John",
        "ownercontactname": "Smith, John",
        "acquisitiondetails": "Lot 143",
        "acquisitionprice": 68500.0000,
        "acquisitionpostdiscounttotal": 68500.0000,
        "acquisitiontotal": 68500.0000,
        "acquisitioncurrencytypeid": 51,
        "acquisitioncurrencytype": "USD",
        "domesticacquisitionprice": 68500.0000,
        "domesticacquisitionpostdiscounttotal": 68500.0000,
        "domesticacquisitiontotal": 68500.0000,
        "acquisitionconversionrate": 1.0,
        "currentvaluationsubject": "Insurance Appraisal",
        "currentvaluationdate": "2011-05-11T00:00:00",
        "currentvaluetype": "Insurance",
        "currentvaluationcurrencytypeid": 51,
        "currentvaluationcurrencytype": "USD",
        "currentvaluationcontact": "Appraisals R Us",
        "currentvalue": 68500.0000,
        "currentdomesticvalue": 68500.0000,
        "currentvaluationconversionrate": 1.0,
        "currentinsurancepolicysubject": "Policy 12",
        "currentinsurancepolicynumber": "123123132",
        "currentinsurancecontact": "MU Insurance",
        "currentinsurancepolicystartdate": "2012-02-26T00:00:00",
        "currentinsurancepolicyenddate": "2013-02-26T00:00:00",
        "currentinsuredvaluecurrencytypeid": 51,
        "currentinsuredvaluecurrencytype": "USD",
        "dimensions": [{
            "dimensionid": 640440,
            "dimensiondescription": "Object",
            "imperialdims": "Object: 15 1/4 x 74 3/4 x 31 1/8 in.",
            "heightimperial": 15.25,
            "widthimperial": 74.75,
            "depthimperial": 31.125,
            "metricdims": "Object: 38.73 x 189.87 x 79.06 cm.",
            "heightmetric": 38.735,
            "widthmetric": 189.865,
            "depthmetric": 79.0575
        }],
        "expenses": [{
            "expenseid": 200214,
            "expensetype": "Acquisition",
            "expensedate": "12/10/2010",
            "expensedatesort": "2010-12-10T00:00:00",
            "expenseamount": 68500.0000,
            "expensetotal": 68500.0000,
            "domesticexpenseamount": 68500.0000,
            "domesticexpensetotal": 68500.0000,
            "expensecurrencytype": "USD",
            "defaultcurrencytype": "USD",
            "expenseconversionrate": 1.0,
            "expensecontactid": 82171,
            "expensecontact": "Sotheby's NY Sale N08680"
        }],
        "groups": [{"groupid": 7495, "groupdescription": "Furniture"}],
        "images": [{"attachmentid": 994564, "filename": "2011-F6.jpg", "filesize": 167052}],
        "insurancepolicies": [{
            "insurancepolicyid": 8116,
            "insurancepolicysubject": "Policy 12",
            "insurancepolicynumber": "123123132",
            "insurancecontactid": 82212,
            "insurancecontact": "MU Insurance",
            "insurancepolicystartdate": "2012-02-26T00:00:00",
            "insurancepolicyenddate": "2013-02-26T00:00:00",
            "insuredvaluecurrencytype": "USD",
            "defaultcurrencytype": "USD"
        }],
        "valuations": [{
            "valuationid": 39599,
            "valuationstatus": "Closed",
            "valuationsubject": "Insurance Appraisal",
            "valuationdate": "2011-05-11T00:00:00",
            "valuetype": "Insurance",
            "valuationcontactid": 82193,
            "valuationcontact": "Appraisals R Us",
            "value": 68500.0000,
            "domesticvalue": 68500.0000,
            "valuationcurrencytype": "USD",
            "defaultcurrencytype": "USD",
            "valuationconversionrate": 1.0,
            "objectvaluationmemo": "Based on purchase price"
        }]
    }, {
        "objectid": 867727,
        "inventorynumber": "2011-A5",
        "uniqueid": "7431631924",
        "objecttype": "Antiquities",
        "imperialdims": "Object: 3 in.",
        "metricdims": "Object: 7.62 cm.",
        "dimensiondescription": "Object",
        "heightimperial": 3.0,
        "heightmetric": 7.62,
        "mainimageattachmentid": 994555,
        "mainimagefilename": "2011-A5.jpg",
        "mainimagefilesize": 160302,
        "locationid": 90380,
        "locationname": "New York Apartment",
        "fulllocationname": "New York Apartment - Foyer",
        "collectionid": 20761,
        "collectionname": "Antiquities",
        "fullcollectionname": "Antiquities",
        "title": "A Figure of a Warrior on Horseback",
        "medium": "bronze",
        "objectdate": "c. 5th/4th century B.C.",
        "countryorigin": "Iberian",
        "objectdescription": "The pony-sized horse standing alertly on an oblong base, the rider wearing a baldric across his chest, his shield attached at the back, and helmet with neck-guard, a sword lying on his chest, his face with carefully modeled eyes and ear.",
        "objectstatuscode": 1,
        "objectstatus": "Current",
        "deaccessioned": false,
        "deleted": false,
        "currentconditionstatus": "Needs Short Term Revisiting",
        "currentconditionexaminedon": "2011-10-04T00:00:00",
        "defaultcurrencytype": "USD",
        "acquisitionid": 182676,
        "acquisitionsubject": "Acquisition 5",
        "acquisitiontype": "Purchase",
        "acquisitiondate": "2010-12-07T00:00:00",
        "acquiredfrom": "Sotheby's NY Sale N08723",
        "boughtby": "Smith, John",
        "ownercontactname": "Smith, John",
        "acquisitiondetails": "Lot 34",
        "acquisitionprice": 25000.0000,
        "acquisitionpostdiscounttotal": 25000.0000,
        "acquisitiontotal": 25000.0000,
        "acquisitioncurrencytypeid": 51,
        "acquisitioncurrencytype": "USD",
        "domesticacquisitionprice": 25000.0000,
        "domesticacquisitionpostdiscounttotal": 25000.0000,
        "domesticacquisitiontotal": 25000.0000,
        "acquisitionconversionrate": 1.0,
        "currentvaluationsubject": "Insurance Appraisal",
        "currentvaluationdate": "2011-05-11T00:00:00",
        "currentvaluetype": "Insurance",
        "currentvaluationcurrencytypeid": 51,
        "currentvaluationcurrencytype": "USD",
        "currentvaluationcontact": "Appraisals R Us",
        "currentvalue": 25000.0000,
        "currentdomesticvalue": 25000.0000,
        "currentvaluationconversionrate": 1.0,
        "conditions": [{
            "conditionid": 149114,
            "conditionexaminedon": "2011-10-04T00:00:00",
            "conditionstatus": "Needs Short Term Revisiting"
        }],
        "dimensions": [{
            "dimensionid": 640431,
            "dimensiondescription": "Object",
            "imperialdims": "Object: 3 in.",
            "heightimperial": 3.0,
            "metricdims": "Object: 7.62 cm.",
            "heightmetric": 7.62
        }],
        "expenses": [{
            "expenseid": 200215,
            "expensetype": "Acquisition",
            "expensedate": "12/07/2010",
            "expensedatesort": "2010-12-07T00:00:00",
            "expenseamount": 25000.0000,
            "expensetotal": 25000.0000,
            "domesticexpenseamount": 25000.0000,
            "domesticexpensetotal": 25000.0000,
            "expensecurrencytype": "USD",
            "defaultcurrencytype": "USD",
            "expenseconversionrate": 1.0,
            "expensecontactid": 82174,
            "expensecontact": "Sotheby's NY Sale N08723"
        }],
        "images": [{"attachmentid": 994555, "filename": "2011-A5.jpg", "filesize": 160302}],
        "valuations": [{
            "valuationid": 39599,
            "valuationstatus": "Closed",
            "valuationsubject": "Insurance Appraisal",
            "valuationdate": "2011-05-11T00:00:00",
            "valuetype": "Insurance",
            "valuationcontactid": 82193,
            "valuationcontact": "Appraisals R Us",
            "value": 25000.0000,
            "domesticvalue": 25000.0000,
            "valuationcurrencytype": "USD",
            "defaultcurrencytype": "USD",
            "valuationconversionrate": 1.0,
            "objectvaluationmemo": "Based on purchase price"
        }]
    }, {
        "objectid": 867728,
        "inventorynumber": "2011-J6",
        "uniqueid": "3903949353",
        "objecttype": "Jewelry & Watches",
        "mainimageattachmentid": 994580,
        "mainimagefilename": "2011-J6.jpg",
        "mainimagefilesize": 181997,
        "locationid": 90381,
        "locationname": "New York Apartment",
        "fulllocationname": "New York Apartment - Guest Bedroom",
        "collectionid": 20764,
        "collectionname": "Jewelry",
        "fullcollectionname": "Jewelry",
        "maker": "CARTIER",
        "title": "Platinum, Natural Pearl, Diamond and Emerald Tassel Brooch",
        "medium": "platinum, natural pearl, diamond and emeral",
        "objectdate": "c. 1915",
        "countryorigin": "France",
        "objectdescription": "The top set with small old mine and rose-cut diamonds, accented by small emerald-cut emeralds, supporting a tassel set with numerous natural pearl strands, natural pearls measuring approximately 2.8 mm., signed Cartier, numbered L5925, workshop mark, French assay marks.",
        "provenance": "Property of a Lady",
        "objectstatuscode": 1,
        "objectstatus": "Current",
        "deaccessioned": false,
        "deleted": false,
        "defaultcurrencytype": "USD",
        "acquisitionid": 182665,
        "acquisitionsubject": "Acquisition 30",
        "acquisitiontype": "Purchase",
        "acquisitiondate": "2010-12-09T00:00:00",
        "acquiredfrom": "Sotheby's NY Sale N08687",
        "boughtby": "Smith, John",
        "ownercontactname": "Smith, John",
        "acquisitiondetails": "Lot 443",
        "acquisitionprice": 92500.0000,
        "acquisitionpostdiscounttotal": 92500.0000,
        "acquisitiontotal": 92500.0000,
        "acquisitioncurrencytypeid": 51,
        "acquisitioncurrencytype": "USD",
        "domesticacquisitionprice": 92500.0000,
        "domesticacquisitionpostdiscounttotal": 92500.0000,
        "domesticacquisitiontotal": 92500.0000,
        "acquisitionconversionrate": 1.0,
        "currentvaluationsubject": "Insurance Appraisal",
        "currentvaluationdate": "2011-05-11T00:00:00",
        "currentvaluetype": "Insurance",
        "currentvaluationcurrencytypeid": 51,
        "currentvaluationcurrencytype": "USD",
        "currentvaluationcontact": "Appraisals R Us",
        "currentvalue": 92500.0000,
        "currentdomesticvalue": 92500.0000,
        "currentvaluationconversionrate": 1.0,
        "currentinsurancepolicysubject": "Policy 15",
        "currentinsurancepolicynumber": "123123132",
        "currentinsurancecontact": "MU Insurance",
        "currentinsurancepolicystartdate": "2012-02-26T00:00:00",
        "currentinsurancepolicyenddate": "2013-02-26T00:00:00",
        "currentinsuredvaluecurrencytypeid": 51,
        "currentinsuredvaluecurrencytype": "USD",
        "saleprice": 55987.0000,
        "salediscount": 15.0000,
        "salediscountpercent": 0.0267919338417847,
        "saletax": 23.0000,
        "saletaxpercent": 0.041091974558707924,
        "salepostdiscounttotal": 55972.0000,
        "saletotal": 55995.0000,
        "domesticsaleprice": 55987.0000,
        "domesticsalediscount": 15.0000,
        "domesticsalediscountpercent": 0.0267919338417847,
        "domesticsaletax": 23.0000,
        "domesticsaletaxpercent": 0.041091974558707924,
        "domesticsalepostdiscounttotal": 55972.0000,
        "domesticsaletotal": 55995.0000,
        "saleconversionrate": 1.0,
        "saledate": "1905",
        "saledatesort": "1905-01-01T00:00:00",
        "saleinvoicedate": "1988-05-23T00:00:00",
        "soldtocontact": "Doe, Jane",
        "salelocation": "New York",
        "salenumber": "48",
        "saledescription": "Sale 4",
        "salelotnumber": "66",
        "salecurrencytypeid": 51,
        "salecurrencytype": "USD",
        "expenses": [{
            "expenseid": 200216,
            "expensetype": "Acquisition",
            "expensedate": "12/09/2010",
            "expensedatesort": "2010-12-09T00:00:00",
            "expenseamount": 92500.0000,
            "expensetotal": 92500.0000,
            "domesticexpenseamount": 92500.0000,
            "domesticexpensetotal": 92500.0000,
            "expensecurrencytype": "USD",
            "defaultcurrencytype": "USD",
            "expenseconversionrate": 1.0,
            "expensecontactid": 82187,
            "expensecontact": "Sotheby's NY Sale N08687"
        }],
        "images": [{"attachmentid": 994580, "filename": "2011-J6.jpg", "filesize": 181997}],
        "insurancepolicies": [{
            "insurancepolicyid": 8119,
            "insurancepolicysubject": "Policy 15",
            "insurancepolicynumber": "123123132",
            "insurancecontactid": 82212,
            "insurancecontact": "MU Insurance",
            "insurancepolicystartdate": "2012-02-26T00:00:00",
            "insurancepolicyenddate": "2013-02-26T00:00:00",
            "insuredvaluecurrencytype": "USD",
            "defaultcurrencytype": "USD"
        }],
        "valuations": [{
            "valuationid": 39599,
            "valuationstatus": "Closed",
            "valuationsubject": "Insurance Appraisal",
            "valuationdate": "2011-05-11T00:00:00",
            "valuetype": "Insurance",
            "valuationcontactid": 82193,
            "valuationcontact": "Appraisals R Us",
            "value": 92500.0000,
            "domesticvalue": 92500.0000,
            "valuationcurrencytype": "USD",
            "defaultcurrencytype": "USD",
            "valuationconversionrate": 1.0,
            "objectvaluationmemo": "Based on purchase price"
        }]
    }, {
        "objectid": 867729,
        "inventorynumber": "2011-S5",
        "uniqueid": "1227832339",
        "objecttype": "Sculpture",
        "imperialdims": "Object: 37 in.",
        "metricdims": "Object: 93.98 cm.",
        "dimensiondescription": "Object",
        "heightimperial": 37.0,
        "heightmetric": 93.98,
        "artistid": 179437,
        "artistname": "Rodin, Auguste 1814-1917",
        "artistfirst": "Auguste",
        "artistlast": "Rodin",
        "artistyears": "1814-1917",
        "mainimageattachmentid": 994589,
        "mainimagefilename": "2011-S5.jpg",
        "mainimagefilesize": 113846,
        "locationid": 90382,
        "locationname": "New York Apartment",
        "fulllocationname": "New York Apartment - Living Room",
        "collectionid": 20765,
        "collectionname": "Sculpture",
        "fullcollectionname": "Sculpture",
        "title": "Iris, Messagere des Dieux",
        "medium": "bronze, black and mottled green patina",
        "objectdate": "1961",
        "objectdescription": "Conceived in 1890-91 and cast in 1961",
        "inscriptions": "Inscribed A. Rodin, stamped with the foundry mark Georges Rudier Foundeur Paris and copyright by Muse Rodin 1961",
        "objectstatuscode": 1,
        "objectstatus": "Current",
        "deaccessioned": false,
        "deleted": false,
        "defaultcurrencytype": "USD",
        "acquisitionid": 182672,
        "acquisitionsubject": "Acquisition 37",
        "acquisitiontype": "Purchase",
        "acquisitiondate": "2004-05-06T00:00:00",
        "acquiredfrom": "Sotheby's NY Sale N07990",
        "boughtby": "Smith, John",
        "ownercontactname": "Smith, John",
        "acquisitiondetails": "Lot 132",
        "acquisitionprice": 512000.0000,
        "acquisitionpostdiscounttotal": 512000.0000,
        "acquisitiontotal": 512000.0000,
        "acquisitioncurrencytypeid": 51,
        "acquisitioncurrencytype": "USD",
        "domesticacquisitionprice": 512000.0000,
        "domesticacquisitionpostdiscounttotal": 512000.0000,
        "domesticacquisitiontotal": 512000.0000,
        "acquisitionconversionrate": 1.0,
        "currentvaluationsubject": "Insurance Appraisal",
        "currentvaluationdate": "2011-05-11T00:00:00",
        "currentvaluetype": "Insurance",
        "currentvaluationcurrencytypeid": 51,
        "currentvaluationcurrencytype": "USD",
        "currentvaluationcontact": "Appraisals R Us",
        "currentvalue": 512000.0000,
        "currentdomesticvalue": 512000.0000,
        "currentvaluationconversionrate": 1.0,
        "currentinsurancepolicysubject": "Policy 13",
        "currentinsurancepolicynumber": "123123132",
        "currentinsurancecontact": "MU Insurance",
        "currentinsurancepolicystartdate": "2012-02-26T00:00:00",
        "currentinsurancepolicyenddate": "2013-02-26T00:00:00",
        "currentinsuredvaluecurrencytypeid": 51,
        "currentinsuredvaluecurrencytype": "USD",
        "dimensions": [{
            "dimensionid": 640455,
            "dimensiondescription": "Object",
            "imperialdims": "Object: 37 in.",
            "heightimperial": 37.0,
            "metricdims": "Object: 93.98 cm.",
            "heightmetric": 93.98
        }],
        "exhibitions": [{
            "exhibitionid": 28058,
            "exhibitionsubject": "Sculpture in Bronze 2 - December 1998 - November 1998",
            "exhibitiontitle": "Sculpture in Bronze 2",
            "exhibitiondate": "December 1998 - November 2000",
            "exhibitiondatesort": "1998-12-01T00:00:00",
            "exhibitionstartdate": "December 1998",
            "exhibitionstartdatesort": "1998-12-01T00:00:00",
            "exhibitionenddate": "November 2000",
            "exhibitionenddatesort": "2000-11-01T00:00:00",
            "exhibitionlocation": "New York, NY"
        }],
        "expenses": [{
            "expenseid": 200254,
            "expensetype": "Other",
            "expensedate": "3/5/1993",
            "expensedatesort": "1993-03-05T00:00:00",
            "expenseamount": 5.2300,
            "expensetotal": 5.2300,
            "domesticexpenseamount": 5.2300,
            "domesticexpensetotal": 5.2300,
            "expensecurrencytype": "USD",
            "defaultcurrencytype": "USD",
            "expenseconversionrate": 1.0,
            "expensecontactid": 82203,
            "expensecontact": "Fortina, Lynda",
            "referencenumber": "Invoice# 55",
            "expensememo": "Design Fee"
        }, {
            "expenseid": 200217,
            "expensetype": "Acquisition",
            "expensedate": "05/06/2004",
            "expensedatesort": "2004-05-06T00:00:00",
            "expenseamount": 512000.0000,
            "expensetotal": 512000.0000,
            "domesticexpenseamount": 512000.0000,
            "domesticexpensetotal": 512000.0000,
            "expensecurrencytype": "USD",
            "defaultcurrencytype": "USD",
            "expenseconversionrate": 1.0,
            "expensecontactid": 82169,
            "expensecontact": "Sotheby's NY Sale N07990"
        }],
        "groups": [{"groupid": 7493, "groupdescription": "things i want to consider"}],
        "images": [{"attachmentid": 994589, "filename": "2011-S5.jpg", "filesize": 113846}],
        "insurancepolicies": [{
            "insurancepolicyid": 8117,
            "insurancepolicysubject": "Policy 13",
            "insurancepolicynumber": "123123132",
            "insurancecontactid": 82212,
            "insurancecontact": "MU Insurance",
            "insurancepolicystartdate": "2012-02-26T00:00:00",
            "insurancepolicyenddate": "2013-02-26T00:00:00",
            "insuredvaluecurrencytype": "USD",
            "defaultcurrencytype": "USD"
        }],
        "valuations": [{
            "valuationid": 39599,
            "valuationstatus": "Closed",
            "valuationsubject": "Insurance Appraisal",
            "valuationdate": "2011-05-11T00:00:00",
            "valuetype": "Insurance",
            "valuationcontactid": 82193,
            "valuationcontact": "Appraisals R Us",
            "value": 512000.0000,
            "domesticvalue": 512000.0000,
            "valuationcurrencytype": "USD",
            "defaultcurrencytype": "USD",
            "valuationconversionrate": 1.0,
            "objectvaluationmemo": "Based on purchase price"
        }]
    }, {
        "objectid": 867730,
        "inventorynumber": "2011-F1",
        "uniqueid": "9461717239",
        "objecttype": "Furniture",
        "imperialdims": "Overall: 140 x 44 x 21 in.",
        "metricdims": "Overall: 355.6 x 111.76 x 53.34 cm.",
        "dimensiondescription": "Overall",
        "heightimperial": 140.0,
        "heightmetric": 355.6,
        "widthimperial": 44.0,
        "widthmetric": 111.76,
        "depthimperial": 21.0,
        "depthmetric": 53.34,
        "artistid": 179450,
        "artistname": "Zwiener, Joseph-Emmanuel b. 1849",
        "artistfirst": "Joseph-Emmanuel",
        "artistlast": "Zwiener",
        "artistyears": "b. 1849",
        "mainimageattachmentid": 994559,
        "mainimagefilename": "2011-F1.jpg",
        "mainimagefilesize": 220597,
        "locationid": 90382,
        "locationname": "New York Apartment",
        "fulllocationname": "New York Apartment - Living Room",
        "collectionid": 20763,
        "collectionname": "Furniture",
        "fullcollectionname": "Furniture",
        "title": "An Important and Monumental Regulateur de Parquet",
        "medium": "gilt-bronze mounted kingwood and bois de bout floral marquetry",
        "objectdate": "c. 1889",
        "objectdescription": "The left hand side putto has been removed to reveal the ZN stamp from the bronze master model, further letter Z visible to other gilt-bronze elements, the twin-train movement stamped Etienne Maxant/Brevet/4 Rue Saintonge. PARIS and numbered 16998.",
        "objectstatuscode": 1,
        "objectstatus": "Current",
        "deaccessioned": false,
        "deleted": false,
        "defaultcurrencytype": "USD",
        "acquisitionid": 182680,
        "acquisitionsubject": "Acquisition 9",
        "acquisitiontype": "Purchase",
        "acquisitiondate": "2010-10-26T00:00:00",
        "acquiredfrom": "Sotheby's NY Sale N08672",
        "boughtby": "Smith, John",
        "ownercontactname": "Smith, John",
        "acquisitiondetails": "Lot 147",
        "acquisitionprice": 722500.0000,
        "acquisitionpostdiscounttotal": 722500.0000,
        "acquisitiontotal": 722500.0000,
        "acquisitioncurrencytypeid": 51,
        "acquisitioncurrencytype": "USD",
        "domesticacquisitionprice": 722500.0000,
        "domesticacquisitionpostdiscounttotal": 722500.0000,
        "domesticacquisitiontotal": 722500.0000,
        "acquisitionconversionrate": 1.0,
        "currentvaluationsubject": "Insurance Appraisal",
        "currentvaluationdate": "2011-05-11T00:00:00",
        "currentvaluetype": "Insurance",
        "currentvaluationcurrencytypeid": 51,
        "currentvaluationcurrencytype": "USD",
        "currentvaluationcontact": "Appraisals R Us",
        "currentvalue": 722500.0000,
        "currentdomesticvalue": 722500.0000,
        "currentvaluationconversionrate": 1.0,
        "currentinsurancepolicysubject": "Policy 14",
        "currentinsurancepolicynumber": "123123132",
        "currentinsurancecontact": "MU Insurance",
        "currentinsurancepolicystartdate": "2012-02-26T00:00:00",
        "currentinsurancepolicyenddate": "2013-02-26T00:00:00",
        "currentinsuredvaluecurrencytypeid": 51,
        "currentinsuredvaluecurrencytype": "USD",
        "dimensions": [{
            "dimensionid": 640435,
            "dimensiondescription": "Overall",
            "imperialdims": "Overall: 140 x 44 x 21 in.",
            "heightimperial": 140.0,
            "widthimperial": 44.0,
            "depthimperial": 21.0,
            "metricdims": "Overall: 355.6 x 111.76 x 53.34 cm.",
            "heightmetric": 355.6,
            "widthmetric": 111.76,
            "depthmetric": 53.34
        }],
        "expenses": [{
            "expenseid": 200218,
            "expensetype": "Acquisition",
            "expensedate": "10/26/2010",
            "expensedatesort": "2010-10-26T00:00:00",
            "expenseamount": 722500.0000,
            "expensetotal": 722500.0000,
            "domesticexpenseamount": 722500.0000,
            "domesticexpensetotal": 722500.0000,
            "expensecurrencytype": "USD",
            "defaultcurrencytype": "USD",
            "expenseconversionrate": 1.0,
            "expensecontactid": 82190,
            "expensecontact": "Sotheby's NY Sale N08672"
        }],
        "groups": [{"groupid": 7495, "groupdescription": "Furniture"}],
        "images": [{"attachmentid": 994559, "filename": "2011-F1.jpg", "filesize": 220597}],
        "insurancepolicies": [{
            "insurancepolicyid": 8118,
            "insurancepolicysubject": "Policy 14",
            "insurancepolicynumber": "123123132",
            "insurancecontactid": 82212,
            "insurancecontact": "MU Insurance",
            "insurancepolicystartdate": "2012-02-26T00:00:00",
            "insurancepolicyenddate": "2013-02-26T00:00:00",
            "insuredvaluecurrencytype": "USD",
            "defaultcurrencytype": "USD"
        }],
        "loans": [{
            "loanid": 5332,
            "exhibitionname": "Furniture",
            "borrower": "Victoria & Albert Museum",
            "loansubject": "Loan 2",
            "loantype": "Loan In",
            "loanstartdate": "2013-05-02T00:00:00",
            "loanenddate": "2014-01-25T00:00:00",
            "loanreleasedate": "2013-04-15T00:00:00",
            "loanreceiveddate": "2013-04-25T00:00:00",
            "insurer": "Furniture Insurance",
            "insuredtotal": 84000.0000,
            "domesticinsuredtotal": 138600.0000,
            "loandateofconversionrate": "2013-04-25T00:00:00",
            "defaultcurrencytype": "USD",
            "loanconversionrate": 1.65,
            "insuredtotalcurrencytype": "GBP"
        }],
        "valuations": [{
            "valuationid": 39599,
            "valuationstatus": "Closed",
            "valuationsubject": "Insurance Appraisal",
            "valuationdate": "2011-05-11T00:00:00",
            "valuetype": "Insurance",
            "valuationcontactid": 82193,
            "valuationcontact": "Appraisals R Us",
            "value": 722500.0000,
            "domesticvalue": 722500.0000,
            "valuationcurrencytype": "USD",
            "defaultcurrencytype": "USD",
            "valuationconversionrate": 1.0,
            "objectvaluationmemo": "Based on purchase price"
        }]
    }, {
        "objectid": 867731,
        "inventorynumber": "2011-A6",
        "uniqueid": "6240000443",
        "objecttype": "Antiquities",
        "imperialdims": "Overall: 14 1/2 in.",
        "metricdims": "Overall: 36.83 cm.",
        "dimensiondescription": "Overall",
        "heightimperial": 14.5,
        "heightmetric": 36.83,
        "mainimageattachmentid": 994556,
        "mainimagefilename": "2011-A6.jpg",
        "mainimagefilesize": 119573,
        "locationid": 90383,
        "locationname": "New York Apartment",
        "fulllocationname": "New York Apartment - Master Bedroom",
        "collectionid": 20761,
        "collectionname": "Antiquities",
        "fullcollectionname": "Antiquities",
        "title": "A Portrait Head of a Man",
        "medium": "marble",
        "categorystyle": "Roman Imperial, Julio-Claudian",
        "objectdate": "probably reign of Nero, c. A.D. 54-68",
        "objectdescription": "Turned to his left, the hair radiating from the crown and falling in crescentic locks over the forehead, temples, and nape of the neck, his face with strong chin, aquiline nose, and finely carved eyes beneath the arched eyebrows.",
        "objectstatuscode": 1,
        "objectstatus": "Current",
        "deaccessioned": false,
        "deleted": false,
        "currentconservationstatus": "OK",
        "currenttreatmentdate": "2010-12-07T00:00:00",
        "defaultcurrencytype": "USD",
        "acquisitionid": 182677,
        "acquisitionsubject": "Acquisition 6",
        "acquisitiontype": "Purchase",
        "acquisitiondate": "2010-12-07T00:00:00",
        "acquiredfrom": "Sotheby's NY Sale N08723",
        "boughtby": "Smith, John",
        "ownercontactname": "Smith, John",
        "acquisitiondetails": "Lot 17",
        "acquisitionprice": 458500.0000,
        "acquisitionpostdiscounttotal": 458500.0000,
        "acquisitiontotal": 458500.0000,
        "acquisitioncurrencytypeid": 51,
        "acquisitioncurrencytype": "USD",
        "domesticacquisitionprice": 458500.0000,
        "domesticacquisitionpostdiscounttotal": 458500.0000,
        "domesticacquisitiontotal": 458500.0000,
        "acquisitionconversionrate": 1.0,
        "currentvaluationsubject": "Insurance Appraisal",
        "currentvaluationdate": "2011-05-11T00:00:00",
        "currentvaluetype": "Insurance",
        "currentvaluationcurrencytypeid": 51,
        "currentvaluationcurrencytype": "USD",
        "currentvaluationcontact": "Appraisals R Us",
        "currentvalue": 458500.0000,
        "currentdomesticvalue": 458500.0000,
        "currentvaluationconversionrate": 1.0,
        "currentinsurancepolicysubject": "Policy 17",
        "currentinsurancepolicynumber": "123123132",
        "currentinsurancecontact": "MU Insurance",
        "currentinsurancepolicystartdate": "2012-02-26T00:00:00",
        "currentinsurancepolicyenddate": "2013-02-26T00:00:00",
        "currentinsuredvaluecurrencytypeid": 51,
        "currentinsuredvaluecurrencytype": "USD",
        "currentinsuredvalue": 458500.0000,
        "currentdomesticinsuredvalue": 458500.0000,
        "currentinsuredvalueconversionrate": 1.0,
        "conservation": [{"conservationid": 2206, "treatmentdate": "2010-12-07T00:00:00", "conservationstatus": "OK"}],
        "dimensions": [{
            "dimensionid": 640432,
            "dimensiondescription": "Overall",
            "imperialdims": "Overall: 14 1/2 in.",
            "heightimperial": 14.5,
            "metricdims": "Overall: 36.83 cm.",
            "heightmetric": 36.83
        }],
        "expenses": [{
            "expenseid": 200219,
            "expensetype": "Acquisition",
            "expensedate": "12/07/2010",
            "expensedatesort": "2010-12-07T00:00:00",
            "expenseamount": 458500.0000,
            "expensetotal": 458500.0000,
            "domesticexpenseamount": 458500.0000,
            "domesticexpensetotal": 458500.0000,
            "expensecurrencytype": "USD",
            "defaultcurrencytype": "USD",
            "expenseconversionrate": 1.0,
            "expensecontactid": 82174,
            "expensecontact": "Sotheby's NY Sale N08723"
        }],
        "images": [{"attachmentid": 994556, "filename": "2011-A6.jpg", "filesize": 119573}],
        "insurancepolicies": [{
            "insurancepolicyid": 8121,
            "insurancepolicysubject": "Policy 17",
            "insurancepolicynumber": "123123132",
            "insurancecontactid": 82212,
            "insurancecontact": "MU Insurance",
            "insurancepolicystartdate": "2012-02-26T00:00:00",
            "insurancepolicyenddate": "2013-02-26T00:00:00",
            "insuredvalue": 458500.0000,
            "domesticinsuredvalue": 458500.0000,
            "insuredvaluecurrencytype": "USD",
            "defaultcurrencytype": "USD",
            "insuredvalueconversionrate": 1.0
        }],
        "publications": [{
            "publicationid": 35212,
            "publicationtitle": "Pices de choix de la collection du Comte Grgoire Stroganoff  Rome",
            "author": "Ludwig Pollak and Antonio Muoz",
            "publicationtype": "Book",
            "publicationdate": "1911-1912",
            "publicationdatesort": "1912-11-01T00:00:00",
            "journal": "vol. 1",
            "publicationmemo": "pl. XVI"
        }, {
            "publicationid": 35211,
            "publicationtitle": "Photographische Enzyklopdie Antiker Sculpturen",
            "author": "Paul Arndt",
            "publicationtype": "Book",
            "publicationdate": "1931",
            "publicationdatesort": "1931-01-01T00:00:00",
            "publicationmemo": "nos. 3504-3505, illus."
        }],
        "valuations": [{
            "valuationid": 39599,
            "valuationstatus": "Closed",
            "valuationsubject": "Insurance Appraisal",
            "valuationdate": "2011-05-11T00:00:00",
            "valuetype": "Insurance",
            "valuationcontactid": 82193,
            "valuationcontact": "Appraisals R Us",
            "value": 458500.0000,
            "domesticvalue": 458500.0000,
            "valuationcurrencytype": "USD",
            "defaultcurrencytype": "USD",
            "valuationconversionrate": 1.0,
            "objectvaluationmemo": "Based on purchase price"
        }]
    }, {
        "objectid": 867732,
        "inventorynumber": "2011-J4",
        "uniqueid": "3169585017",
        "objecttype": "Jewelry & Watches",
        "mainimageattachmentid": 994578,
        "mainimagefilename": "2011-J4.jpg",
        "mainimagefilesize": 492867,
        "locationid": 90383,
        "locationname": "New York Apartment",
        "fulllocationname": "New York Apartment - Master Bedroom",
        "inventorydate": "2007-07-05T00:00:00",
        "collectionid": 20764,
        "collectionname": "Jewelry",
        "fullcollectionname": "Jewelry",
        "title": "18 Karat Gold and Diamond Brooch",
        "medium": "18 karat gold and diamond",
        "objectdescription": "Set in the center with round diamonds weighing approximately 4.25 carats, the petals set with single-cut diamonds weighing approximately 2.00 carats.",
        "objectstatuscode": 1,
        "objectstatus": "Current",
        "deaccessioned": false,
        "deleted": false,
        "defaultcurrencytype": "USD",
        "acquisitionid": 182662,
        "acquisitionsubject": "Acquisition 28",
        "acquisitiontype": "Purchase",
        "acquisitiondate": "2010-09-28T00:00:00",
        "acquiredfrom": "Sotheby's NY Sale N08667",
        "boughtby": "Smith, John",
        "ownercontactname": "Smith, John",
        "acquisitiondetails": "Lot 200",
        "acquisitionprice": 6250.0000,
        "acquisitionpostdiscounttotal": 6250.0000,
        "acquisitiontotal": 6250.0000,
        "acquisitioncurrencytypeid": 51,
        "acquisitioncurrencytype": "USD",
        "domesticacquisitionprice": 6250.0000,
        "domesticacquisitionpostdiscounttotal": 6250.0000,
        "domesticacquisitiontotal": 6250.0000,
        "acquisitionconversionrate": 1.0,
        "currentvaluationsubject": "Insurance Appraisal",
        "currentvaluationdate": "2011-05-11T00:00:00",
        "currentvaluetype": "Insurance",
        "currentvaluationcurrencytypeid": 51,
        "currentvaluationcurrencytype": "USD",
        "currentvaluationcontact": "Appraisals R Us",
        "currentvalue": 6250.0000,
        "currentdomesticvalue": 6250.0000,
        "currentvaluationconversionrate": 1.0,
        "currentinsurancepolicysubject": "Policy 16",
        "currentinsurancepolicynumber": "123123132",
        "currentinsurancecontact": "MU Insurance",
        "currentinsurancepolicystartdate": "2012-02-26T00:00:00",
        "currentinsurancepolicyenddate": "2013-02-26T00:00:00",
        "currentinsuredvaluecurrencytypeid": 51,
        "currentinsuredvaluecurrencytype": "USD",
        "components": [{
            "componentid": 4872,
            "componentnumber": "2",
            "componentlocationstatus": "Permanent Location",
            "componentlocationid": 90404,
            "componentfulllocationname": "Jewelry Storage - Jewelry Case - Earring Section",
            "componentform": "Jewelry",
            "componentdimensiondescription": "Individual gems",
            "componentimperialdims": "Individual gems:",
            "componentmetricdims": "Individual gems:",
            "componentdeaccessioned": false
        }],
        "expenses": [{
            "expenseid": 200220,
            "expensetype": "Acquisition",
            "expensedate": "09/28/2010",
            "expensedatesort": "2010-09-28T00:00:00",
            "expenseamount": 6250.0000,
            "expensetotal": 6250.0000,
            "domesticexpenseamount": 6250.0000,
            "domesticexpensetotal": 6250.0000,
            "expensecurrencytype": "USD",
            "defaultcurrencytype": "USD",
            "expenseconversionrate": 1.0,
            "expensecontactid": 82170,
            "expensecontact": "Sotheby's NY Sale N08667"
        }],
        "images": [{"attachmentid": 994578, "filename": "2011-J4.jpg", "filesize": 492867}],
        "insurancepolicies": [{
            "insurancepolicyid": 8120,
            "insurancepolicysubject": "Policy 16",
            "insurancepolicynumber": "123123132",
            "insurancecontactid": 82212,
            "insurancecontact": "MU Insurance",
            "insurancepolicystartdate": "2012-02-26T00:00:00",
            "insurancepolicyenddate": "2013-02-26T00:00:00",
            "insuredvaluecurrencytype": "USD",
            "defaultcurrencytype": "USD"
        }],
        "valuations": [{
            "valuationid": 39599,
            "valuationstatus": "Closed",
            "valuationsubject": "Insurance Appraisal",
            "valuationdate": "2011-05-11T00:00:00",
            "valuetype": "Insurance",
            "valuationcontactid": 82193,
            "valuationcontact": "Appraisals R Us",
            "value": 6250.0000,
            "domesticvalue": 6250.0000,
            "valuationcurrencytype": "USD",
            "defaultcurrencytype": "USD",
            "valuationconversionrate": 1.0,
            "objectvaluationmemo": "Based on purchase price"
        }]
    }, {
        "objectid": 867733,
        "inventorynumber": "2011-J2",
        "uniqueid": "0597049451",
        "objecttype": "Jewelry & Watches",
        "mainimageattachmentid": 994576,
        "mainimagefilename": "2011-J2.jpg",
        "mainimagefilesize": 239098,
        "locationid": 90384,
        "locationname": "New York Apartment",
        "fulllocationname": "New York Apartment - Safe",
        "collectionid": 20764,
        "collectionname": "Jewelry",
        "fullcollectionname": "Jewelry",
        "maker": "LaCloche",
        "title": "Platinum, Diamond, and Emerald Fountain Brooch",
        "medium": "platinum, diamond and emerald",
        "objectdate": "c. 1925",
        "countryorigin": "Paris",
        "objectdescription": "The stylized water fountain set with round, old European-cut and single-cut diamonds weighing approximately 2.75 carats, accented by calibr-cut emeralds, signed Lacloche, Paris, workshop mark, French assay marks. With signed and fitted box",
        "objectstatuscode": 1,
        "objectstatus": "Current",
        "deaccessioned": false,
        "deleted": false,
        "defaultcurrencytype": "USD",
        "acquisitionid": 182660,
        "acquisitionsubject": "Acquisition 26",
        "acquisitiontype": "Purchase",
        "acquisitiondate": "2010-04-20T00:00:00",
        "acquiredfrom": "Sotheby's NY Sale N08626",
        "boughtby": "Smith, John",
        "ownercontactname": "Smith, John",
        "acquisitiondetails": "Lot 110",
        "acquisitionprice": 28750.0000,
        "acquisitionpostdiscounttotal": 28750.0000,
        "acquisitiontotal": 28750.0000,
        "acquisitioncurrencytypeid": 51,
        "acquisitioncurrencytype": "USD",
        "domesticacquisitionprice": 28750.0000,
        "domesticacquisitionpostdiscounttotal": 28750.0000,
        "domesticacquisitiontotal": 28750.0000,
        "acquisitionconversionrate": 1.0,
        "currentvaluationsubject": "Insurance Appraisal",
        "currentvaluationdate": "2011-05-11T00:00:00",
        "currentvaluetype": "Insurance",
        "currentvaluationcurrencytypeid": 51,
        "currentvaluationcurrencytype": "USD",
        "currentvaluationcontact": "Appraisals R Us",
        "currentvalue": 28750.0000,
        "currentdomesticvalue": 28750.0000,
        "currentvaluationconversionrate": 1.0,
        "currentinsurancepolicysubject": "Policy 18",
        "currentinsurancepolicynumber": "123123132",
        "currentinsurancecontact": "MU Insurance",
        "currentinsurancepolicystartdate": "2012-02-26T00:00:00",
        "currentinsurancepolicyenddate": "2013-02-26T00:00:00",
        "currentinsuredvaluecurrencytypeid": 51,
        "currentinsuredvaluecurrencytype": "USD",
        "expenses": [{
            "expenseid": 200221,
            "expensetype": "Acquisition",
            "expensedate": "04/20/2010",
            "expensedatesort": "2010-04-20T00:00:00",
            "expenseamount": 28750.0000,
            "expensetotal": 28750.0000,
            "domesticexpenseamount": 28750.0000,
            "domesticexpensetotal": 28750.0000,
            "expensecurrencytype": "USD",
            "defaultcurrencytype": "USD",
            "expenseconversionrate": 1.0,
            "expensecontactid": 82176,
            "expensecontact": "Sotheby's NY Sale N08626"
        }],
        "images": [{"attachmentid": 994576, "filename": "2011-J2.jpg", "filesize": 239098}],
        "insurancepolicies": [{
            "insurancepolicyid": 8122,
            "insurancepolicysubject": "Policy 18",
            "insurancepolicynumber": "123123132",
            "insurancecontactid": 82212,
            "insurancecontact": "MU Insurance",
            "insurancepolicystartdate": "2012-02-26T00:00:00",
            "insurancepolicyenddate": "2013-02-26T00:00:00",
            "insuredvaluecurrencytype": "USD",
            "defaultcurrencytype": "USD"
        }],
        "valuations": [{
            "valuationid": 39599,
            "valuationstatus": "Closed",
            "valuationsubject": "Insurance Appraisal",
            "valuationdate": "2011-05-11T00:00:00",
            "valuetype": "Insurance",
            "valuationcontactid": 82193,
            "valuationcontact": "Appraisals R Us",
            "value": 28750.0000,
            "domesticvalue": 28750.0000,
            "valuationcurrencytype": "USD",
            "defaultcurrencytype": "USD",
            "valuationconversionrate": 1.0,
            "objectvaluationmemo": "Based on purchase price"
        }]
    }, {
        "objectid": 867734,
        "inventorynumber": "2011-FA8",
        "uniqueid": "0957361537",
        "objecttype": "Paintings",
        "imperialdims": "Panel: 20 1/4 x 16 1/8 in.",
        "metricdims": "Panel: 51.44 x 40.96 cm.",
        "dimensiondescription": "Panel",
        "heightimperial": 20.25,
        "heightmetric": 51.435,
        "widthimperial": 16.125,
        "widthmetric": 40.9575,
        "artistid": 179447,
        "artistname": "Dou, Gerrit 1613-1675",
        "artistfirst": "Gerrit",
        "artistlast": "Dou",
        "artistyears": "1613-1675",
        "mainimageattachmentid": 994574,
        "mainimagefilename": "2011-FA8.jpg",
        "mainimagefilesize": 287347,
        "locationid": 90384,
        "locationname": "New York Apartment",
        "fulllocationname": "New York Apartment - Safe",
        "collectionid": 20762,
        "collectionname": "Fine Art",
        "fullcollectionname": "Fine Art",
        "title": "An Elderly Woman, Seated by a Window at her Spinning Wheel, Eating Porridge",
        "medium": "oil on panel",
        "provenance": "Property of a Private Collector",
        "objectstatuscode": 1,
        "objectstatus": "Current",
        "deaccessioned": false,
        "deleted": false,
        "defaultcurrencytype": "USD",
        "acquisitionid": 182658,
        "acquisitionsubject": "Acquisition 24",
        "acquisitiontype": "Purchase",
        "acquisitiondate": "2011-01-27T00:00:00",
        "acquiredfrom": "Sotheby's NY Sale N08712",
        "boughtby": "Smith, John",
        "ownercontactname": "Smith, John",
        "acquisitiondetails": "Lot 151",
        "acquisitionprice": 5346500.0000,
        "acquisitionpostdiscounttotal": 5346500.0000,
        "acquisitiontotal": 5346500.0000,
        "acquisitioncurrencytypeid": 51,
        "acquisitioncurrencytype": "USD",
        "domesticacquisitionprice": 5346500.0000,
        "domesticacquisitionpostdiscounttotal": 5346500.0000,
        "domesticacquisitiontotal": 5346500.0000,
        "acquisitionconversionrate": 1.0,
        "currentvaluationsubject": "Insurance Appraisal",
        "currentvaluationdate": "2011-05-11T00:00:00",
        "currentvaluetype": "Insurance",
        "currentvaluationcurrencytypeid": 51,
        "currentvaluationcurrencytype": "USD",
        "currentvaluationcontact": "Appraisals R Us",
        "currentvalue": 5346500.0000,
        "currentdomesticvalue": 5346500.0000,
        "currentvaluationconversionrate": 1.0,
        "currentinsurancepolicysubject": "Policy 19",
        "currentinsurancepolicynumber": "123123132",
        "currentinsurancecontact": "MU Insurance",
        "currentinsurancepolicystartdate": "2012-02-26T00:00:00",
        "currentinsurancepolicyenddate": "2013-02-26T00:00:00",
        "currentinsuredvaluecurrencytypeid": 51,
        "currentinsuredvaluecurrencytype": "USD",
        "saleprice": 10229.0000,
        "salediscount": 20.0000,
        "salediscountpercent": 0.19552253397204031,
        "saletax": 102.7900,
        "saletaxpercent": 1.0068566950729749,
        "salepostdiscounttotal": 10209.0000,
        "saletotal": 10311.7900,
        "domesticsaleprice": 10229.0000,
        "domesticsalediscount": 20.0000,
        "domesticsalediscountpercent": 0.19552253397204031,
        "domesticsaletax": 102.7900,
        "domesticsaletaxpercent": 1.0068566950729749,
        "domesticsalepostdiscounttotal": 10209.0000,
        "domesticsaletotal": 10311.7900,
        "saleconversionrate": 1.0,
        "saledate": "11/15/2003",
        "saledatesort": "2003-11-15T00:00:00",
        "saleinvoicedate": "2003-11-15T00:00:00",
        "saledetails": "Gallery",
        "soldtocontact": "Dunkin, Fiona",
        "salelocation": "San Francisco",
        "salenumber": "307",
        "saledescription": "Sale 3",
        "salelotnumber": "15",
        "salecurrencytypeid": 51,
        "salecurrencytype": "USD",
        "dimensions": [{
            "dimensionid": 640450,
            "dimensiondescription": "Panel",
            "imperialdims": "Panel: 20 1/4 x 16 1/8 in.",
            "heightimperial": 20.25,
            "widthimperial": 16.125,
            "metricdims": "Panel: 51.44 x 40.96 cm.",
            "heightmetric": 51.435,
            "widthmetric": 40.9575
        }],
        "expenses": [{
            "expenseid": 200222,
            "expensetype": "Acquisition",
            "expensedate": "01/27/2011",
            "expensedatesort": "2011-01-27T00:00:00",
            "expenseamount": 5346500.0000,
            "expensetotal": 5346500.0000,
            "domesticexpenseamount": 5346500.0000,
            "domesticexpensetotal": 5346500.0000,
            "expensecurrencytype": "USD",
            "defaultcurrencytype": "USD",
            "expenseconversionrate": 1.0,
            "expensecontactid": 82185,
            "expensecontact": "Sotheby's NY Sale N08712"
        }],
        "images": [{"attachmentid": 994574, "filename": "2011-FA8.jpg", "filesize": 287347}],
        "insurancepolicies": [{
            "insurancepolicyid": 8123,
            "insurancepolicysubject": "Policy 19",
            "insurancepolicynumber": "123123132",
            "insurancecontactid": 82212,
            "insurancecontact": "MU Insurance",
            "insurancepolicystartdate": "2012-02-26T00:00:00",
            "insurancepolicyenddate": "2013-02-26T00:00:00",
            "insuredvaluecurrencytype": "USD",
            "defaultcurrencytype": "USD"
        }],
        "valuations": [{
            "valuationid": 39599,
            "valuationstatus": "Closed",
            "valuationsubject": "Insurance Appraisal",
            "valuationdate": "2011-05-11T00:00:00",
            "valuetype": "Insurance",
            "valuationcontactid": 82193,
            "valuationcontact": "Appraisals R Us",
            "value": 5346500.0000,
            "domesticvalue": 5346500.0000,
            "valuationcurrencytype": "USD",
            "defaultcurrencytype": "USD",
            "valuationconversionrate": 1.0,
            "objectvaluationmemo": "Based on purchase price"
        }]
    }, {
        "objectid": 867735,
        "inventorynumber": "2011-J7",
        "uniqueid": "6655643321",
        "objecttype": "Jewelry & Watches",
        "mainimageattachmentid": 994581,
        "mainimagefilename": "2011-J7.jpg",
        "mainimagefilesize": 352255,
        "locationid": 90385,
        "locationname": "Storage",
        "fulllocationname": "Storage - Unit 1",
        "collectionid": 20764,
        "collectionname": "Jewelry",
        "fullcollectionname": "Jewelry",
        "title": "Platinum, Emerald Bead, and Diamond Necklace",
        "medium": "platinum, emerald bead, and diamond",
        "objectdescription": "Supporting a fringe of emerald bead pendants, supported by a necklace composed of emerald beads, total weight of emeralds approximately 665.00 carats, accented by round diamonds weighing approximately 43.00 carats, length 15 inches.",
        "objectstatuscode": 1,
        "objectstatus": "Current",
        "deaccessioned": false,
        "deleted": false,
        "defaultcurrencytype": "USD",
        "acquisitionid": 182666,
        "acquisitionsubject": "Acquisition 31",
        "acquisitiontype": "Purchase",
        "acquisitiondate": "2010-04-20T00:00:00",
        "acquiredfrom": "Sotheby's NY Sale N08626",
        "boughtby": "Smith, John",
        "ownercontactname": "Smith, John",
        "acquisitiondetails": "Lot 233",
        "acquisitionprice": 422500.0000,
        "acquisitionpostdiscounttotal": 422500.0000,
        "acquisitiontotal": 422500.0000,
        "acquisitioncurrencytypeid": 51,
        "acquisitioncurrencytype": "USD",
        "domesticacquisitionprice": 422500.0000,
        "domesticacquisitionpostdiscounttotal": 422500.0000,
        "domesticacquisitiontotal": 422500.0000,
        "acquisitionconversionrate": 1.0,
        "currentvaluationsubject": "Insurance Appraisal",
        "currentvaluationdate": "2011-05-11T00:00:00",
        "currentvaluetype": "Insurance",
        "currentvaluationcurrencytypeid": 51,
        "currentvaluationcurrencytype": "USD",
        "currentvaluationcontact": "Appraisals R Us",
        "currentvalue": 422500.0000,
        "currentdomesticvalue": 422500.0000,
        "currentvaluationconversionrate": 1.0,
        "currentinsurancepolicysubject": "Policy 6",
        "currentinsurancepolicynumber": "123123132",
        "currentinsurancecontact": "MU Insurance",
        "currentinsurancepolicystartdate": "2012-02-26T00:00:00",
        "currentinsurancepolicyenddate": "2013-02-26T00:00:00",
        "currentinsuredvaluecurrencytypeid": 51,
        "currentinsuredvaluecurrencytype": "USD",
        "saleprice": 88756.0000,
        "salediscount": 15.0000,
        "salediscountpercent": 0.016900265897516788,
        "saletax": 55.0000,
        "saletaxpercent": 0.06197811609064581,
        "salepostdiscounttotal": 88741.0000,
        "saletotal": 88796.0000,
        "saledateofconversionrate": "2007-01-08T00:00:00",
        "domesticsaleprice": 165973.7200,
        "domesticsalediscount": 28.0500,
        "domesticsalediscountpercent": 0.016900265897516788,
        "domesticsaletax": 102.8500,
        "domesticsaletaxpercent": 0.061978116090645796,
        "domesticsalepostdiscounttotal": 165945.6700,
        "domesticsaletotal": 166048.5200,
        "saleconversionrate": 1.87,
        "saledate": "01/08/2007",
        "saledatesort": "2007-01-08T00:00:00",
        "saleinvoicedate": "2007-01-08T00:00:00",
        "saledetails": "Auction",
        "soldtocontact": "Alex, James - Sotheby's",
        "salelocation": "London",
        "salenumber": "125",
        "saledescription": "Sale 5",
        "salelotnumber": "23",
        "salecurrencytypeid": 49,
        "salecurrencytype": "GBP",
        "expenses": [{
            "expenseid": 200223,
            "expensetype": "Acquisition",
            "expensedate": "04/20/2010",
            "expensedatesort": "2010-04-20T00:00:00",
            "expenseamount": 422500.0000,
            "expensetotal": 422500.0000,
            "domesticexpenseamount": 422500.0000,
            "domesticexpensetotal": 422500.0000,
            "expensecurrencytype": "USD",
            "defaultcurrencytype": "USD",
            "expenseconversionrate": 1.0,
            "expensecontactid": 82176,
            "expensecontact": "Sotheby's NY Sale N08626"
        }],
        "images": [{"attachmentid": 994581, "filename": "2011-J7.jpg", "filesize": 352255}],
        "insurancepolicies": [{
            "insurancepolicyid": 8145,
            "insurancepolicysubject": "Policy 6",
            "insurancepolicynumber": "123123132",
            "insurancecontactid": 82212,
            "insurancecontact": "MU Insurance",
            "insurancepolicystartdate": "2012-02-26T00:00:00",
            "insurancepolicyenddate": "2013-02-26T00:00:00",
            "insuredvaluecurrencytype": "USD",
            "defaultcurrencytype": "USD"
        }],
        "valuations": [{
            "valuationid": 39599,
            "valuationstatus": "Closed",
            "valuationsubject": "Insurance Appraisal",
            "valuationdate": "2011-05-11T00:00:00",
            "valuetype": "Insurance",
            "valuationcontactid": 82193,
            "valuationcontact": "Appraisals R Us",
            "value": 422500.0000,
            "domesticvalue": 422500.0000,
            "valuationcurrencytype": "USD",
            "defaultcurrencytype": "USD",
            "valuationconversionrate": 1.0,
            "objectvaluationmemo": "Based on purchase price"
        }]
    }, {
        "objectid": 867736,
        "inventorynumber": "2011-J5",
        "uniqueid": "9920976166",
        "objecttype": "Jewelry & Watches",
        "mainimageattachmentid": 994579,
        "mainimagefilename": "2011-J5.jpg",
        "mainimagefilesize": 297937,
        "locationid": 90385,
        "locationname": "Storage",
        "fulllocationname": "Storage - Unit 1",
        "collectionid": 20764,
        "collectionname": "Jewelry",
        "fullcollectionname": "Jewelry",
        "maker": "CARTIER",
        "title": "18 Karat Gold, Platinum, Amethyst, Turquoise, and Diamond Necklace",
        "medium": "18 karat gold, platinum, amethyst, turquoise and diamond",
        "objectdate": "1949",
        "countryorigin": "New York",
        "objectdescription": "Set with pear-shaped amethysts, accented by turquoise cabochons, and round diamonds weighing approximately 9.80 carats, within braided gold rope strands, completed by a braided gold rope chain, length 19 inches, signed Cartier, numbered 3436NA, French export marks.",
        "objectstatuscode": 1,
        "objectstatus": "Current",
        "deaccessioned": false,
        "deleted": false,
        "defaultcurrencytype": "USD",
        "acquisitionid": 182663,
        "acquisitionsubject": "Acquisition 29",
        "acquisitiontype": "Purchase",
        "acquisitiondate": "2010-09-28T00:00:00",
        "acquiredfrom": "Sotheby's NY Sale N08667",
        "boughtby": "Smith, John",
        "ownercontactname": "Smith, John",
        "acquisitiondetails": "Lot 403",
        "acquisitionprice": 122500.0000,
        "acquisitionpostdiscounttotal": 122500.0000,
        "acquisitiontotal": 122500.0000,
        "acquisitioncurrencytypeid": 51,
        "acquisitioncurrencytype": "USD",
        "domesticacquisitionprice": 122500.0000,
        "domesticacquisitionpostdiscounttotal": 122500.0000,
        "domesticacquisitiontotal": 122500.0000,
        "acquisitionconversionrate": 1.0,
        "currentvaluationsubject": "Insurance Appraisal",
        "currentvaluationdate": "2011-05-11T00:00:00",
        "currentvaluetype": "Insurance",
        "currentvaluationcurrencytypeid": 51,
        "currentvaluationcurrencytype": "USD",
        "currentvaluationcontact": "Appraisals R Us",
        "currentvalue": 122500.0000,
        "currentdomesticvalue": 122500.0000,
        "currentvaluationconversionrate": 1.0,
        "currentinsurancepolicysubject": "Policy 7",
        "currentinsurancepolicynumber": "123123132",
        "currentinsurancecontact": "MU Insurance",
        "currentinsurancepolicystartdate": "2012-02-26T00:00:00",
        "currentinsurancepolicyenddate": "2013-02-26T00:00:00",
        "currentinsuredvaluecurrencytypeid": 51,
        "currentinsuredvaluecurrencytype": "USD",
        "components": [{
            "componentid": 4873,
            "componentnumber": "8",
            "componentlocationstatus": "Permanent Location",
            "componentlocationid": 90400,
            "componentfulllocationname": "Living Room - Jewelry Carrier",
            "componentmaker": "Cartier",
            "componentform": "Jewelry",
            "componentdimensiondescription": "Individual gems",
            "componentimperialdims": "Individual gems:",
            "componentmetricdims": "Individual gems:",
            "componentdeaccessioned": false
        }],
        "expenses": [{
            "expenseid": 200224,
            "expensetype": "Acquisition",
            "expensedate": "09/28/2010",
            "expensedatesort": "2010-09-28T00:00:00",
            "expenseamount": 122500.0000,
            "expensetotal": 122500.0000,
            "domesticexpenseamount": 122500.0000,
            "domesticexpensetotal": 122500.0000,
            "expensecurrencytype": "USD",
            "defaultcurrencytype": "USD",
            "expenseconversionrate": 1.0,
            "expensecontactid": 82170,
            "expensecontact": "Sotheby's NY Sale N08667"
        }],
        "images": [{"attachmentid": 994579, "filename": "2011-J5.jpg", "filesize": 297937}],
        "insurancepolicies": [{
            "insurancepolicyid": 8146,
            "insurancepolicysubject": "Policy 7",
            "insurancepolicynumber": "123123132",
            "insurancecontactid": 82212,
            "insurancecontact": "MU Insurance",
            "insurancepolicystartdate": "2012-02-26T00:00:00",
            "insurancepolicyenddate": "2013-02-26T00:00:00",
            "insuredvaluecurrencytype": "USD",
            "defaultcurrencytype": "USD"
        }],
        "valuations": [{
            "valuationid": 39599,
            "valuationstatus": "Closed",
            "valuationsubject": "Insurance Appraisal",
            "valuationdate": "2011-05-11T00:00:00",
            "valuetype": "Insurance",
            "valuationcontactid": 82193,
            "valuationcontact": "Appraisals R Us",
            "value": 122500.0000,
            "domesticvalue": 122500.0000,
            "valuationcurrencytype": "USD",
            "defaultcurrencytype": "USD",
            "valuationconversionrate": 1.0,
            "objectvaluationmemo": "Based on purchase price"
        }]
    }, {
        "objectid": 867737,
        "inventorynumber": "2011-FA3",
        "uniqueid": "2926053782",
        "objecttype": "Paintings",
